_c0,_c1,_c2
@dulcecafe mailed you on Friday! have re-sent. Thanks,1,dulcecafe mailed friday sent thanks
"@carriekerpen it's heatherwhaling.posterous.com. Like yours, totally random stuff",1,carriekerpen heatherwhaling posterous com like totally random stuff
"@YoungQ Have a safe flight.  Trick is to sleep only for a short time, this way your body won't hate u too much but u still rest  Be Safe",1,youngq safe flight trick sleep short time way body hate u much u still rest safe
Whos going to ATL on wed?,1,whos going atl wed
@ForumTheatreNJ You had the same view that I did yesterday  How was the Street Fair?,1,forumtheatrenj view yesterday street fair
Just finished GCSE Maths exams  YEEEEEEAH!!!,1,finished gcse maths exams yeeeeeeah
cant stop watching the new moon trailer....amazingg!!!,1,cant stop watching new moon trailer amazingg
@phx_m what are YOU doing still up?,1,phx still
super awake so...im going running,1,super awake im going running
#mileymonday #mileymonday #mileymonday #mileymonday #mileymonday #mileymonday #mileymonday #mileymonday #mileymonday #mileymonday  retwee,1,mileymonday mileymonday mileymonday mileymonday mileymonday mileymonday mileymonday mileymonday mileymonday mileymonday retwee
"REALLY wants to watch The Bridges of Madison County right now.. Last full week of school!  School, work, then target with the sister.",1,really wants watch bridges madison county right last full week school school work target sister
@mariapetery yep i remember you   @_musiclover27_ hey jannie haha,1,mariapetery yep remember musiclover27 hey jannie haha
@mileycyrus Congratulations,1,mileycyrus congratulations
@gordon have a nice hol.  the snow will be waiting for you when you get back.,1,gordon nice hol snow waiting get back
Paying my 2008 Australian tax  At least I didn't have to pay until now,1,paying 2008 australian tax least pay
@gracedent or at least 'crack' a smile?,1,gracedent least 'crack' smile
Working on live show this next two weeks with vision &amp; valor. Hope they're ready!,1,working live show next two weeks vision amp valor hope ready
@Michfoshizzle you can? then you have a very special power!  i usually made them cry more or began to cry myself. i just stay quiet now &gt;&lt;,1,michfoshizzle special power usually made cry began cry stay quiet gt lt
Gretsch guitar's are my favourites,1,gretsch guitar favourites
In our favorite asian restaurant. Having thai japanese chinese korean lunch. Yum,1,favorite asian restaurant thai japanese chinese korean lunch yum
@hassanch oh God i can't wait!!!!i'm going out 4 a drink now/lemonade hehehehe hope u enjoy ur day,1,hassanch oh god cannot wait going 4 drink lemonade hehehehe hope u enjoy ur day
Also going to clean out the closet in my classroom and the filing cabinet in my office! I love tossing things at this time of year!,1,also going clean closet classroom filing cabinet office love tossing things time year
"@marcar Oh, I meant kids games in general - I'm building an app",1,marcar oh meant kids games general building app
Wow ! 8 days of school + 5 exams = Summer dude !,1,wow 8 days school 5 exams summer dude
@OmberZombie Fools. Oh well. One day they'll get the balance right. It's just a question of time,1,omberzombie fools oh well one day get balance right question time
@Monty_ yep! red as a lobster,1,monty yep red lobster
"@shefaly Ah yes, the negative externality fear.",1,shefaly ah yes negative externality fear
@_J_A_M_E_S_ its okay ;) like ya  ;),1,j e okay like ya
"@vp31det nice , thanks  I guess i will be making some more apples lol but in different colors . Something fun &amp; bright",1,vp31det nice thanks guess making apples lol different colors something fun amp bright
"@johncmayer  this is true... i always do something with hands, like making a paper crane our of the napkin is a winner",1,johncmayer true always something hands like making paper crane napkin winner
"@katbaldwyn Actually forget that, it's not anything to do with expenses or BGT so no-one will be interested. LOLSATIRES!",1,katbaldwyn actually forget anything expenses bgt one interested lolsatires
@gadgeterija U 1 crazy (insert expletive)  kickin' some butt w/ those wheels... tico rulzz... I hade his big brother Matiz for 7 years,1,gadgeterija u 1 crazy insert expletive kickin' butt w wheels tico rulzz hade big brother matiz 7 years
"Me: &quot;Woo! I hit 20,000 subscribers today!&quot; My mom: &quot;Wow. 20,000 rejects in the world.&quot; hahaha. FML!",1,quot woo hit 20 000 subscribers today quot mom quot wow 20 000 rejects world quot hahaha fml
well gudmornin,1,well gudmornin
@smudge372 yeah am ok . You ok,1,smudge372 yeah ok ok
I woke up this morning at 4:45am and just decided to stay up. I'm glad I did.  I am early for a change. Yay!,1,woke morning 4 45am decided stay glad early change yay
i get a new phone today!! woohoo,1,get new phone today woohoo
#Bing ain't all that crazy -- http://bit.ly/zwdqb  -- credit to whom credit is due. Bing is okay.,1,bing crazy
"Boa semana, followers.",1,boa semana followers
"Looking forward to the 20th june, its when i go and see the saturdays on tour in wolverhampton",1,looking forward 20th june go see saturdays tour wolverhampton
@PrincessDx How strange I'm leaving soon.,1,princessdx strange leaving soon
#musicmonday Memories  &lt;3  ♫ http://blip.fm/~7f85p,1,musicmonday memories lt 3 ♫
@tojulius Does that make you a Berlusconi fan too,1,tojulius make berlusconi fan
Is loving the sunny weather,1,loving sunny weather
i'm watching tv and on computer,1,watching tv computer
@Old_reprobate @hedgemint hello lovely happy tweeps. pleasure to see you,1,old reprobate hedgemint hello lovely happy tweeps pleasure see
want to party,1,want party
"working on the diss and listening to the soundtracks to The OC, which is what i listened to whilst packing for uni the first time around",1,working diss listening soundtracks oc listened whilst packing uni first time around
Just got sent home from school for being to far ahead despite missing 3 weeks of school. Woot.,1,got sent home school far ahead despite missing 3 weeks school woot
@Dublins98Dave I was there yesterday.... it was a bit of a knack-fest so heading to Malahide beach today instead,1,dublins98dave yesterday bit knack fest heading malahide beach today instead
@1sweetwhirl hello how are you doing today?  Hope you are having a great day.,1,1sweetwhirl hello today hope great day
@DerrenLitten It was so funny!  Sky + it so we can watch it again,1,derrenlitten funny sky watch
will eat yogurt with ahiya  http://plurk.com/p/xm3l1,1,eat yogurt ahiya
@lostgirl66 What biscuits have you got today then??!!,1,lostgirl66 biscuits got today
"I want some marshmellows right now... And nachos... And massive shades...Oh yeah, and I want jet pack shoes",1,want marshmellows right nachos massive shades oh yeah want jet pack shoes
"@eskimowoman thurs 4am, excited &amp; apprehensive, still so much 2 do b4 I leave! You 2 Leb Fri? Looking fwd to mezze? Nom nom",1,eskimowoman thurs 4am excited amp apprehensive still much 2 b4 leave 2 leb fri looking fwd mezze nom nom
i'm OUT.,1,null
Dotsavvy goes mobile web @ http://www.dotsavvy.mobi. Still work-in-progress but finally mobile friendly!,1,dotsavvy goes mobile web
"@coachbear for a very short period, I did at Chasers  First shift was Rawhide....",1,coachbear short period chasers first shift rawhide
off to see saving aimee and the mission district tonight!,1,see saving aimee mission district tonight
@davenavarro6767 I'm truly stunned you read it. Thanks!,1,davenavarro6767 truly stunned read thanks
I feel pretty pro. Right now  i think its the flats .  23days&lt;3,1,feel pretty pro right think flats 23days lt 3
"@__DearAngel__x hehe, i'm divy from indonesia. How bout youu?  ah, mind if you follow me back? lol",1,dearangel x hehe divy indonesia bout youu ah mind follow back lol
planning vaca this month for greece! finally got approval from CD  just have to book everything and finalise who's coming! whoopeee,1,planning vaca month greece finally got approval cd book everything finalise coming whoopeee
@Serendipi 11th June,1,serendipi 11th june
thunderstorms just the way i like it,1,thunderstorms way like
Had hardcore bands stay at our house last night! Didn't get a headache but didn't get much sleep. I think they had fun,1,hardcore bands stay house last night get headache get much sleep think fun
@dazron Nah just me ski-slope like nose is a bit of a suntrap. You wanted it to have been punched didnt you? Bloody design nazi,1,dazron nah ski slope like nose bit suntrap wanted punched didnt bloody design nazi
@kristinchapa call me when you see your phone crazy girl! we have plans later today remember,1,kristinchapa call see phone crazy girl plans later today remember
"This site is awesome, Rotate recurring tweets, set up tweets to go throughout the day, rotate tweets as well  http://atomurl.org/1635/",1,site awesome rotate recurring tweets set tweets go throughout day rotate tweets well
48 Days Til Adelaideeeee  Hannah's swine flu song is mad as.,1,48 days til adelaideeeee hannah swine flu song mad
"wishing @stephanie_cheng alien :O a happy birthday  jks, ur my mushroom girl!",1,wishing stephanie cheng alien happy birthday jks ur mushroom girl
Monday night is dessert night in our house - I made banana cream pie...sweet! Enjoy my own company on a Monday,1,monday night dessert night house made banana cream pie sweet enjoy company monday
@devakishor fuckers screw us in no-parking area!!! Always,1,devakishor fuckers screw us parking area always
@jemjem1983 Aww you'll be fine Jem. And just imagine how much better you will feel afterwards!,1,jemjem1983 aww fine jem imagine much better feel afterwards
"@danielboys break a leg for tonight! wish i could be there, saw you in oxford though, was an amazing night  and ill def be buying the cd!",1,danielboys break leg tonight wish could saw oxford though amazing night ill def buying cd
"Need to send emails to 100,000  contacts? Check out EmailUnlimited on http://www.4officeautomation.com",1,need send emails 100 000 contacts check emailunlimited
@WSIRK Wat an awesome way to start out your monday!    TaShA,1,wsirk wat awesome way start monday tasha
@lollujo hey thanks for the follow  I eft a comment on your blog this morning hope you got it!,1,lollujo hey thanks follow eft comment blog morning hope got
@chrisyoungken Cool ;p lol Enjoy the rest off your day!,1,chrisyoungken cool p lol enjoy rest day
schooll. laurens spending the nitee. cedar point tmrw.!!,1,schooll laurens spending nitee cedar point tmrw
commented Mileys pic on her twitter and on the MTV movie awards website! Love you Miley and always will forever and ever!,1,commented mileys pic twitter mtv movie awards website love miley always forever ever
@joeymcintyre when did crush groove come out?  We're only 3 yrs apart   I'll have 2 look up both fat boys and this one cuz I am curious,1,joeymcintyre crush groove come 3 yrs apart 2 look fat boys one cuz curious
@lisa_pinup i'm not sure babe! but what i'm sure of is definitely gonna be good!!!,1,lisa pinup sure babe sure definitely gonna good
@Banksyart2 miserable on this fine sunny day? some people need to chillax!,1,banksyart2 miserable fine sunny day people need chillax
Morning people,1,morning people
@Camcobain merci^^ yes i study french at school..for almost 3 years now  im 15..how old are u?,1,camcobain merci^^ yes study french school almost 3 years im 15 old u
"Ate a `lil bit of shomai, but it`s not for dinner , I`m not yet taking dinner actually..and edited a new photo of Archie  ..",1,ate `lil bit shomai it`s dinner i`m yet taking dinner actually edited new photo archie
"Still haven't gotten 92 RNG, but I reached 86 SUM instead!  I can now summon Rune Minotaurs",1,still gotten 92 rng reached 86 sum instead summon rune minotaurs
@AskCarrieLee watched the vid.Those guys play well.,1,askcarrielee watched vid guys play well
Just had dinner with Louise bby. Tomorrow party in chalet with her! HA finally daddykins allow me to stay overnight! MIRACLE,1,dinner louise bby tomorrow party chalet ha finally daddykins allow stay overnight miracle
Damn its too early. but im getting ready for work already. Gotta make that money.,1,damn early im getting ready work already gotta make money
FAMILY GUY JUST SAID &quot;MEDIOCRE&quot; - and mediocre is my all time favourite word  tell me your favourite word? http://tumblr.com/xta1x6gpg,1,family guy said quot mediocre quot mediocre time favourite word tell favourite word
@Dojie how do you feel bout joining th twitter family.,1,dojie feel bout joining th twitter family
@belindaang haha. then coffee was a good choice,1,belindaang haha coffee good choice
@worthelle san yan? FB?,1,worthelle san yan fb
@twittervlog  my thoughts exactly.,1,twittervlog thoughts exactly
"Was just out, in the sun  Going to go back out soon, then I have got to go and do my papers :| :|... Camping tonight though...   ;) xx",1,sun going go back soon got go papers camping tonight though xx
@NiceBallz Best of luck to you as well sir,1,niceballz best luck well sir
@yelyahwilliams those movies are amazing to the max.  which one is your favorite so far? haha.,1,yelyahwilliams movies amazing max one favorite far haha
"@MrSocial Beware of those taxi drivers lol. Where are you staying, we stayed in the InterContinental. Very nice",1,mrsocial beware taxi drivers lol staying stayed intercontinental nice
@keza34 @pob34 dont worry  @Dojie likes me really,1,keza34 pob34 dont worry dojie likes really
says ROBEHLAYT ng buhay ko!  http://plurk.com/p/xm3p7,1,says robehlayt ng buhay ko
#github и #habr забыл,1,github и habr забыл
Exam over now! Yes at home now waiting for my pizza to be done!,1,exam yes home waiting pizza done
..maybe its cause I started my mornnnnin off with BANANA breaaaad,1,maybe cause started mornnnnin banana breaaaad
@aknecker is up early walking so I'm getting a early jump on the day before the kids get up. Could get used to the peace and quiet,1,aknecker early walking getting early jump day kids get could get used peace quiet
The Events Manager (v1.0b) has been rolled to the live CRM server!  TechAmerica staff may now create events straight from CRM!,1,events manager v1 0b rolled live crm server techamerica staff may create events straight crm
"school, home, maybe downtown to make an appointment to get my hair done in three weeks",1,school home maybe downtown make appointment get hair done three weeks
"@passi66  Good morning Passi, was a horrible game, they lost 8 - 2 lol,  Have a great day too",1,passi66 good morning passi horrible game lost 8 2 lol great day
@e_bookpushers Have a good day! I am going to try to be conscious - it does help with a 3 year old blaring out Dora and FiFi full blast,1,e bookpushers good day going try conscious help 3 year old blaring dora fifi full blast
@icarusforde not too high to make you lose balance and fall,1,icarusforde high make lose balance fall
@bing Guys i can pass your censoring filters just by using spaces in my keywords. Ex. S E X Y instead of sexy.Please fix it,1,bing guys pass censoring filters using spaces keywords ex e x instead sexy please fix
"@Karageorgakis I will  I know theres lots to see in Greece , i like to see places with history",1,karageorgakis know theres lots see greece like see places history
"For once, #microsoft has gotten it right on #bing for search.  @armchairdude",1,microsoft gotten right bing search armchairdude
So incredibly excited for warped tour!  -121908inlove(:,1,incredibly excited warped tour 121908inlove
@TheJackle Enjoy the peace,1,thejackle enjoy peace
"@mintsauce Yup, with suggestive padding and font-size to make the text appear where you want",1,mintsauce yup suggestive padding font size make text appear want
That's right... It's 6am and I'm just now going to sleep! But I had a blast with my roomie! Looks like it's going to be a great summer!,1,right 6am going sleep blast roomie looks like going great summer
"has an hour long lunch break and then back to session 2 with the little kids  finish at 3.. 2 weeks, so far so good",1,hour long lunch break back session 2 little kids finish 3 2 weeks far good
@ljones1981 lol.. I don't know.. Just smile and have a fantastic day instead,1,ljones1981 lol know smile fantastic day instead
&quot;If it wasn't for bad luck...&quot;  ♫ http://blip.fm/~7f87f,1,quot bad luck quot ♫
"TFHS @ BHS, ---   big, non big, lower tennis tournament match to show who's the best at being mediocre... We got this locked up",1,tfhs bhs big non big lower tennis tournament match show best mediocre got locked
@vikkichowney   Good choice   Excellent set of producers on that album,1,vikkichowney good choice excellent set producers album
"@EveD I would LOVE to attend. I've sent a mail to @hfordsa, can't help to 'double-ask'",1,eved would love attend sent mail hfordsa cannot help 'double ask'
Any card game fighter (web-based)  ? let's meet @ --&gt; http://www.alteil.com/,1,card game fighter web based let us meet gt
@Amity_Cafe Yummy how much in the mail? Discount? I'll review!,1,amity cafe yummy much mail discount review
@shhham i think you know WHO i'm talking about b/c i just told you my life has ended D: i dont think the cards are due in DDD:,1,shhham think know talking b c told life ended dont think cards due ddd
@Sonadora LOL! They sent me that same exact comment last night!,1,sonadora lol sent exact comment last night
I have never read or seen Twilight or anything on it's sucessors.  Plan on keeping it that way,1,never read seen twilight anything sucessors plan keeping way
off to class &amp; work in my rainboots!,1,class amp work rainboots
"@ddlovato haha &quot;mothers, others and jonas brothers&quot;  i love that one",1,ddlovato haha quot mothers others jonas brothers quot love one
just got home. haha twitter! haha. went to the grocery with my moma. haha  waiting for the food delivery. hmm. hungrrryyy!,1,got home haha twitter haha went grocery moma haha waiting food delivery hmm hungrrryyy
"@EmilyAllTimeLow leaving in the morninggg, should be in brissy byyy 11am-1pm  I AM SOOO EXCITED LOL",1,emilyalltimelow leaving morninggg brissy byyy 11am 1pm sooo excited lol
"3215BS search on google http://bit.ly/Iiq0T returns 435 results, on bing http://bit.ly/CdvPJ just 5. One more example of google vs bing",1,3215bs search google
Goh. All American Rejects nu op Pinkpop stream best leuk,1,goh american rejects nu op pinkpop stream best leuk
&quot;Cabin malfunction&quot; - &quot;slight delay&quot; great start,1,quot cabin malfunction quot quot slight delay quot great start
@CongoTwitt we'll work out the details,1,congotwitt work details
Comiczeal kicks ass. that is all,1,comiczeal kicks ass
"@le_penseur_ Wanky name is wan- oh, you beat me to it. Bienvenue, noob.",1,le penseur wanky name wan oh beat bienvenue noob
About to drive to school.... I cant believe its june! Yay!,1,drive school cant believe june yay
@fattysammy Is perfectly cooked and delicious not an option?,1,fattysammy perfectly cooked delicious option
"out getting some sun  visited my grandma earlier, ate some cookies  tweet",1,getting sun visited grandma earlier ate cookies tweet
School+friends+ipod+music+sugar= success,1,school friends ipod music sugar success
Listening to Fischerspooner 'Entertainment' Nice,1,listening fischerspooner 'entertainment' nice
headache from oversleeping,1,headache oversleeping
"@RiddlerMusic Yeah, I'm liking it. Love the name too",1,riddlermusic yeah liking love name
Update: Bruno's Back  http://tinyurl.com/m2knds,1,update bruno back
NO UNI TOMORROW!!!! YUSSSS!!!! Rejoice!!!!,1,uni tomorrow yussss rejoice
@Kathy72490 hi. pls. vote for @Jonasbrothers as Mr. Twitter Universe! and pls. spread the word. thnx!  http://twurl.nl/3vucle,1,kathy72490 hi pls vote jonasbrothers mr twitter universe pls spread word thnx
Chuck Playlist: Christmas TV by Slow Club. From Chuck vs. the Ring  #chuck #chuckmemondays #lovechuck,1,chuck playlist christmas tv slow club chuck vs ring chuck chuckmemondays lovechuck
all fixed.,1,fixed
@fiercefeminist thanks for the shoutout  i wish i had seen you at the rally!,1,fiercefeminist thanks shoutout wish seen rally
here with the awesome cousin pretty pissed coz we got ban from SOF when we were getting good lol such awesome nerds....,1,awesome cousin pretty pissed coz got ban sof getting good lol awesome nerds
"If you ain't got noboby to hate on, feel free to hate on me",1,got noboby hate feel free hate
@YoungQ O well better get my science head on a get writting! Or my boss is going kick my butt,1,youngq well better get science head get writting boss going kick butt
"@THE_WOCKEEZ  that was mind blowing! You guys have a smooth way of coming hard! The beyonce part was hilarious,",1,wockeez mind blowing guys smooth way coming hard beyonce part hilarious
a viagem de balão  http://twitpic.com/6e8u5 confere @martim it really happen,1,viagem de balão
@MOOVMNT gotta check that out,1,moovmnt gotta check
@bohemianrose I think so..just takes money. Sigh,1,bohemianrose think takes money sigh
"Had a fantastic weekend!!!  Lots of sun, the ocean,  bbq'ing....ahhhh.  Another fantastic hot sunny day in Wales today.",1,fantastic weekend lots sun ocean bbq'ing ahhhh another fantastic hot sunny day wales today
i love my hubbi  thanks 4 being so sweet xo,1,love hubbi thanks 4 sweet xo
It was indeed the least they could do! Have you started writing your angry letter to the Menzies hotel? I'm gonna write my blog tonight,1,indeed least could started writing angry letter menzies hotel gonna write blog tonight
Going to work.  Exhausted! I'd rather be sleeping. Looking forward to tonight so I can be home again relaxing. Have a good day tweeters!,1,going work exhausted would rather sleeping looking forward tonight home relaxing good day tweeters
"@AshesBorn Thus, I've managed to get back to writing, artwork and started photography. All that's left is music of some kind ha!",1,ashesborn thus managed get back writing artwork started photography left music kind ha
"Vote for me! I'm down by two votes and I need your help  http://bit.ly/ftMss (click top left &quot;register,&quot; sign up &amp; then you can vote!)",1,vote two votes need help
@NewMommasWorld Send my greetings to ur hubby,1,newmommasworld send greetings ur hubby
"Woohoo! Scored a DJ for the reception. For free.  Now just need to get equipment sorted, and entertainment is mostly done...",1,woohoo scored dj reception free need get equipment sorted entertainment mostly done
@CherylColeUK I'll be in Glasgow for The Sats concert tomorrow so I'll say Happy Birthday now...Happy Birthday!,1,cherylcoleuk glasgow sats concert tomorrow say happy birthday happy birthday
Is Enjoying Her Day Of School But Wantes Her Ankle To Get Better,1,enjoying day school wantes ankle get better
what happends today?? any idea? sun is shining.. maybe take the bike to dads job 2 miles .. yeah maybe,1,happends today idea sun shining maybe take bike dads job 2 miles yeah maybe
"today going to the BSS with anna, freddi und nadin  That's gonna be fun  see you then. Achja Wish you very much fun at the Pink-Pop",1,today going bss anna freddi und nadin gonna fun see achja wish much fun pink pop
Luckily this weeks show is not internet based. Just need to record some bits for the beginning. Wifi pretty speedy in the hotel,1,luckily weeks show internet based need record bits beginning wifi pretty speedy hotel
"@sadknob I love this, attack spammers back by making fun. Got any other names we can decode???",1,sadknob love attack spammers back making fun got names decode
Good morning all   Time for another lovely week,1,good morning time another lovely week
Waiting to have my first physical therapy session this morning.  I hope it helps!,1,waiting first physical therapy session morning hope helps
@jms_ it was fantastic and tiring,1,jms fantastic tiring
@hotsports Hello Lady  How have you been??,1,hotsports hello lady
@CodeBeard we caved months ago... We still annoy her by banging on her wall whenever she's too loud though,1,codebeard caved months ago still annoy banging wall whenever loud though
Transport for London are refunding my money RESULT,1,transport london refunding money result
@shelleyyuniarti happy bday yaaa ciksel!! Sukses selalu hehehe,1,shelleyyuniarti happy bday yaaa ciksel sukses selalu hehehe
@Me_Piglet Good day to you too!  Have a creative photoshoping!,1,piglet good day creative photoshoping
@lucydurack Sounds like sydney is a lot of fun. Good luck tomorrow,1,lucydurack sounds like sydney lot fun good luck tomorrow
Tonight am invited at Radio Cluj to talk about a Green Action sustained by us - CFR Park. 22:00 hrs. Green rulz,1,tonight invited radio cluj talk green action sustained us cfr park 22 00 hrs green rulz
@edenhig The girl that got the Ddub shout-out is CUCKOO. You would NOT want the association. Trust me.,1,edenhig girl got ddub shout cuckoo would want association trust
got few of my photos printed  i liked the print quality of pixetra,1,got photos printed liked print quality pixetra
Night guys! Thanks for a lovley evening,1,night guys thanks lovley evening
Or this meg ryan needs to find her tom hanks cus I'm sleepless in san diego...that sounds better,1,meg ryan needs find tom hanks cus sleepless san diego sounds better
@littlecathvamp CATH KEMBARAN KUUU,1,littlecathvamp cath kembaran kuuu
"anyway, off to bed with me",1,anyway bed
@Rosymeg - yeah well that's b'coz your body is trying to fight the cold..man Kelly is really funny...she's cool!,1,rosymeg yeah well b'coz body trying fight cold man kelly really funny cool
@markryes @julie_moore has just been spotted on fb so should be here soon  x,1,markryes julie moore spotted fb soon x
@ashedryden with FileSocial you can upload and share up to 50 mb. Give us a try!  - http://filesocial.com,1,ashedryden filesocial upload share 50 mb give us try
