_c0,_c1,_c2
@ladygaga just saw... paparazzzzzzi  AND ITS AMAZZZZZZZZING,1,ladygaga saw paparazzzzzzi amazzzzzzzzing
@gillmac good luck!,1,gillmac good luck
good morning,1,good morning
@KayDeeFortuin actually I was just mocking you two and your dancing... that was cute tho,1,kaydeefortuin actually mocking two dancing cute tho
Going to the beach with my  big  sis,1,going beach big sis
"Im going well im history, suprising that. coming 3",1,im going well im history suprising coming 3
Inbox inbox inbox. @clarchrs is going mad at me,1,inbox inbox inbox clarchrs going mad
@siduli perhaps lodge a complaint with www.getclosure.co.za @getclosure re: KFC - not Hello Peter,1,siduli perhaps lodge complaint www getclosure co za getclosure kfc hello peter
@MrsOTF Sounds like a much needed treat! Enjoy,1,mrsotf sounds like much needed treat enjoy
This is DEEEEEP  http://bit.ly/dWOvf,1,deeeeep
"just had gelatto with mary &amp; heather, and awesome lasagna, colosseum &amp; sistine chapel today! (In the rain!)",1,gelatto mary amp heather awesome lasagna colosseum amp sistine chapel today rain
Listening to The Ketchup Song now! Brings back memories  lol I don't know what ever possessed me to listen to this thing all over again.,1,listening ketchup song brings back memories lol know ever possessed listen thing
"goin to sleep now, nunightt",1,goin sleep nunightt
@alxalxalx  Lol. They all worked collaboratively. The robin was the ringmaster,1,alxalxalx lol worked collaboratively robin ringmaster
@smeieralbano I saw you the other day at Fashion Week! You're gorgeous.,1,smeieralbano saw day fashion week gorgeous
its amazing how happy mr sunny makes you  xx,1,amazing happy mr sunny makes xx
@Music4urSoul &amp; @Babelpop thank you's &lt;3 luckily i felt pretty comfortable while performing,1,music4ursoul amp babelpop thank lt 3 luckily felt pretty comfortable performing
I'm going to this reggae show tonight in NYC: Reggae artist Cezar at SOB's @ 9pm!!! He's dope. I co-sign. Don't miss it,1,going reggae show tonight nyc reggae artist cezar sob 9pm dope co sign miss
Bing - I may have spoken too soon   http://bit.ly/80VFz,1,bing may spoken soon
good morning shrooms  guna be fucked for school.,1,good morning shrooms guna fucked school
"@eweirdguy I bet... the terminology is puzzling to me.  [seriously though, have fun]",1,eweirdguy bet terminology puzzling seriously though fun
"@kapachino Hey Kap, How did you get your account unsuspended, or did Twitter just do it?  I had to start over...  Aargh!",1,kapachino hey kap get account unsuspended twitter start aargh
@truckerfrank  for rt - hope you are keeping well,1,truckerfrank rt hope keeping well
"@liaquintans Haha  Btw, I've finished doing the invitation for my birthday. I'll send you a digital copy. What's your email address?",1,liaquintans haha btw finished invitation birthday send digital copy email address
marconies show reminds me why i love 'odd' music so much. &quot;tortoise&quot; with out of tune guitars. brilliant,1,marconies show reminds love 'odd' music much quot tortoise quot tune guitars brilliant
I HATE being SICK!!!!!!! &gt; 11 days until my birthday,1,hate sick gt 11 days birthday
says PCSIANS hoorey  weee . http://plurk.com/p/xm21k,1,says pcsians hoorey weee
"@stefalways lol but his not on myspace atm, rofl when he gets on i will ask",1,stefalways lol myspace atm rofl gets ask
@adiyadoni Think they cleaned it up good man... Cannot find it anywhere.,1,adiyadoni think cleaned good man cannot find anywhere
"... oh, morning by the way",1,oh morning way
"@alexandramusic Same here, I been bk in Londoon from Florida 2 weeks and im stil not sleeping til stupid o clock! Hope it was fun",1,alexandramusic bk londoon florida 2 weeks im stil sleeping til stupid clock hope fun
Watching Beach Ball Babes online,1,watching beach ball babes online
@sleepynikki he is american shorthair but his round head is rather like exotic-shorthair ka,1,sleepynikki american shorthair round head rather like exotic shorthair ka
2 thumbs up for &quot;bruno&quot; stunt on eminem last night,1,2 thumbs quot bruno quot stunt eminem last night
loops n me r goin to bake in the sun today  // @Misses_Gola was great on friday! loads of fun! still talkin with u!!,1,loops n r goin bake sun today misses gola great friday loads fun still talkin u
enjoying soup for dinner.  plus sweet corn!,1,enjoying soup dinner plus sweet corn
Thats an A ensured for my maths if not a low A*!!,1,thats ensured maths low
"@d_TRIX well, that must be fun! happy watching!",1,trix well must fun happy watching
#mileymonday #mileymonday #mileymonday #mileymonday #mileymonday #mileymonday #mileymonday #mileymonday #mileymonday #mileymonday  retwee,1,mileymonday mileymonday mileymonday mileymonday mileymonday mileymonday mileymonday mileymonday mileymonday mileymonday retwee
hello  wonderful day! so sunny and hot  and I'm going for a swim in the pool. ♥,1,hello wonderful day sunny hot going swim pool ♥
@Ankit_A Best of Luck for that,1,ankit best luck
First day of June,1,first day june
on my way to school. only 2 days 'til graduation!,1,way school 2 days 'til graduation
"yay my g1 is updated, Good $$$  morning twitshines!!!",1,yay g1 updated good morning twitshines
Filling in already for someone at work this morning and then I have orientation. Hopefully this day goes fast! Please go fast! K thanks,1,filling already someone work morning orientation hopefully day goes fast please go fast k thanks
"Tja, I don't say it to you. That's secret",1,tja say secret
Goodbye - Kristinia DeBarge  .. such a good song,1,goodbye kristinia debarge good song
....schooollll... there's only 2 weeks anyway.. after that... hello full-time job and endless shopping.  ♥ http://plurk.com/p/xm2g3,1,schooollll 2 weeks anyway hello full time job endless shopping ♥
hitting town with my bff  desperately need to shop!,1,hitting town bff desperately need shop
@northernrach oh hai durrr  you okay?,1,northernrach oh hai durrr okay
http://bit.ly/12f227  he can sing,1,null
@andiedoodle Naps are perfect with this kind of weather.,1,andiedoodle naps perfect kind weather
@arianna_skye my pleasure ...I had a great time,1,arianna skye pleasure great time
My exam ever over LOL yay,1,exam ever lol yay
@FaithfulChosen Good. Glad to hear it - we know you're brilliant and clever anyway! #Faithfan I'll leave you alone now,1,faithfulchosen good glad hear know brilliant clever anyway faithfan leave alone
jake and i are at Kouzina. the first resto to open at Station Streat,1,jake kouzina first resto open station streat
Mr. Four-eyed...,1,mr four eyed
"@ashleigh92 i will haha :') you should just go home ;o haha, i love you baba  xxx",1,ashleigh92 haha ' go home haha love baba xxx
Am I following real Leona Lewis... check it out 4 me,1,following real leona lewis check 4
~ Thinking today might be a pool day...  hmmm  yup yup  Sunny Cheers !,1,~ thinking today might pool day hmmm yup yup sunny cheers
"@shandrarestiana hhii gpp nanya aja, smakin cepet smesteran kan enakk habis itu libur",1,shandrarestiana hhii gpp nanya aja smakin cepet smesteran kan enakk habis itu libur
@myinnersexygirl Good too thanks,1,myinnersexygirl good thanks
field day ! BRIGHT BRAWLERS!,1,field day bright brawlers
@brainstuck name for a bus route? interesting,1,brainstuck name bus route interesting
I have found a cute as vintage dress on ebay... buy it me someone,1,found cute vintage dress ebay buy someone
You text... I come inside and answer you... One or the other now... And I'm staying outside!  Serves you right for not being here! ♥♥,1,text come inside answer one staying outside serves right ♥♥
#mileymonday #mileymonday #mileymonday #mileymonday #mileymonday #mileymonday #mileymonday #mileymonday #mileymonday #mileymonday  retweet,1,mileymonday mileymonday mileymonday mileymonday mileymonday mileymonday mileymonday mileymonday mileymonday mileymonday retweet
.@karinyoshida International Children's day - what can we do?,1,karinyoshida international children day
Getting ready for work feeling good.. Oh yeah  http://tinyurl.com/que4jb,1,getting ready work feeling good oh yeah
"i either have killed hayfever or a cold, I can't decide which yet. Off to Greggs in a bit and then some last minute gf bday shopping",1,either killed hayfever cold cannot decide yet greggs bit last minute gf bday shopping
@kimjensen Haha good on you,1,kimjensen haha good
@kamelka: if counterparty means group of maniacs playing counterstrike.. why not?,1,kamelka counterparty means group maniacs playing counterstrike
@zaca why thankyou  i thought i might see what all the fuss was about!!,1,zaca thankyou thought might see fuss
Internet fail at work continues. It's so sad when IT stop me from working,1,internet fail work continues sad stop working
"@timothyc1985aph Manchester is sunny?! Nah, I refuse to believe that ;-) nice pic!!",1,timothyc1985aph manchester sunny nah refuse believe nice pic
AQUA HAVE AN AWESOME NEW SONG OUT! Back To The 80's  thanks @hot30,1,aqua awesome new song back 80 thanks hot30
do u wanna a piece of me?,1,u wanna piece
Niiiiiiiiinne fuccccccckin days .. i can't beeeeelive it.. at all.. its been 3 fucking years,1,niiiiiiiiinne fuccccccckin days cannot beeeeelive 3 fucking years
: See my Tagalog Version of The Climb by Miley Cyrus - joszeff.multiply.com  http://plurk.com/p/xm2io,1,see tagalog version climb miley cyrus joszeff multiply com
@jazstory: I just wish the universe would've let me sleep for just one more hour.,1,jazstory wish universe would let sleep one hour
@Bass_ stop it... you're making me rofl,1,bass stop making rofl
does anyone wanna do something today? i have to get out of cleaning my room,1,anyone wanna something today get cleaning room
Is excited that it's June,1,excited june
On board plane and just waiting for the last passengers to board. Next stop Newark ! We're both very excited now,1,board plane waiting last passengers board next stop newark excited
@ShivaniRamaiah Have never been to any Mute Plays...wana accompany me along? They m8 b showing something somewhere arnd,1,shivaniramaiah never mute plays wana accompany along m8 b showing something somewhere arnd
Photo: nook’s Portfolio on Behance Love the color  http://tumblr.com/xyc1x6ft3,1,photo nook’s portfolio behance love color
"@carriecruz awww, thanks for the kind words",1,carriecruz awww thanks kind words
@beauarmstrong We're HUGE lake fans...IMHO:  you can't get enough of it!  ;)  Have a great week!,1,beauarmstrong huge lake fans imho cannot get enough great week
"@carnalis sends a strong, rich, dark Italian over to you ;-) Mmmm thank you",1,carnalis sends strong rich dark italian mmmm thank
@vishalgangawane replied...lemme know if anything else  cya,1,vishalgangawane replied lemme know anything else cya
i hope it is fixed 2day... and we will be happy if u make like an exp buff Thx,1,hope fixed 2day happy u make like exp buff thx
Discovery Channel emitirá fifth gear!!! http://bit.ly/aVB8q  POR FIN!!!,1,discovery channel emitirá fifth gear
@_DearAngel_x heey mind if we be buddies?,1,dearangel x heey mind buddies
#mileymonday #mileymonday #mileymonday #mileymonday #mileymonday #mileymonday #mileymonday #mileymonday #mileymonday #mileymonday  retwee,1,mileymonday mileymonday mileymonday mileymonday mileymonday mileymonday mileymonday mileymonday mileymonday mileymonday retwee
@thelistmagazine In the office wearing shorts    Spent a great weekend out in the sun in Holyrood park.,1,thelistmagazine office wearing shorts spent great weekend sun holyrood park
"Going to school!   Well it's not that bad, at least Finals are over!",1,going school well bad least finals
"challenged herself this morning and ran 1hr non-stop, 5.3 mi, avg pace: 11:19/mi!  Yay me!",1,challenged morning ran 1hr non stop 5 3 mi avg pace 11 19 mi yay
@kmacc1 Thanks Kate - hopefully will help to keep me current,1,kmacc1 thanks kate hopefully help keep current
"That's enough study for one night, methinks. My poor brain needs a break - and Brothers and Sisters provides that in spades!",1,enough study one night methinks poor brain needs break brothers sisters provides spades
http://tinyurl.com/nbwqpn ha ha ha - I have a friend who will be delighted to get her gob round this!,1,null
@betsyweber thanks betsy,1,betsyweber thanks betsy
is confused.com at this twitter business,1,confused com twitter business
@jemillahayne the backwards alarm clock,1,jemillahayne backwards alarm clock
@hotsports Send me a piece of the chocolate one please.,1,hotsports send piece chocolate one please
@fudgeit So you realized you are a humor genius after a little while,1,fudgeit realized humor genius little
Amy found my $600 Best Buy card! One of us taped it inside a cabinet door so there's no way we could lose it.   Roomba will soon be mine!,1,amy found 600 best buy card one us taped inside cabinet door way could lose roomba soon mine
what happened to mileys best friend leslie? or lesley i dont know which way she spells it haha  anyone know? x,1,happened mileys best friend leslie lesley dont know way spells haha anyone know x
@Dojie i'm staying out of this,1,dojie staying
"@mleis Strangely: one of my most popular posts  Good morning to you, btw",1,mleis strangely one popular posts good morning btw
"joe: playing with our twitter background image. i don't like them ultra-large, as everywhere seen. bandwidth matters! thats green!",1,joe playing twitter background image like ultra large everywhere seen bandwidth matters thats green
Weather is great again today. Going to do another BBQ today. Yesterday went well. Only two people got food poisoning,1,weather great today going another bbq today yesterday went well two people got food poisoning
@anamolly I'm looking through pics now. Will be posting them soon,1,anamolly looking pics posting soon
"Time to start driving shortly. I should make Springfield, MO tonight",1,time start driving shortly make springfield mo tonight
@CeriQ A big thank you Ceri for stepping up on events.,1,ceriq big thank ceri stepping events
No more exams!yay,1,exams yay
Just been running 10 km! It was suprisingly easy,1,running 10 km suprisingly easy
Just left the investor meeting.... almost 4am... Guess that means it went well,1,left investor meeting almost 4am guess means went well
making a PVC and Leopard Print trim handbag,1,making pvc leopard print trim handbag
hot hot summer.. fu... got a little tan on my face,1,hot hot summer fu got little tan face
@YoungQ keep saving lives one note at a time!! god bless you and what you do,1,youngq keep saving lives one note time god bless
Weekly round-up of kids poetry (a day late!)  http://bit.ly/cZvY3 hope visitors enjoy and please comment if you do,1,weekly round kids poetry day late
"Likes: Defying gravity  stealing calculators , Lee , lucky charms , Summer Mommys new job ! Ah. Dislikes: none   23days&lt;3",1,likes defying gravity stealing calculators lee lucky charms summer mommys new job ah dislikes none 23days lt 3
@ElvaHsiao so u'r already in NYC? WOW!! am lookin' 4ward to ur pics~ha...n just dont 4get to take enough rest after ur dancin' rehearsal~,1,elvahsiao u'r already nyc wow lookin' 4ward ur pics~ha n dont 4get take enough rest ur dancin' rehearsal~
@rlb01 wow thats very nice! Congratulations!,1,rlb01 wow thats nice congratulations
Off to another day of school. Its almost over!,1,another day school almost
"Now that I think of it, @lmkenny I guess #redeye *is* just another FNC show: http://bit.ly/NgCrL  Mikie likey!",1,think lmkenny guess redeye another fnc show
says good evening.  http://plurk.com/p/xm2xf,1,says good evening
@sarabury Okey dokey soudns good.,1,sarabury okey dokey soudns good
my seals video is on Springwatch !!    http://bit.ly/TVAdo,1,seals video springwatch
"good morning, twitter",1,good morning twitter
@claikind I rise and shine and greet the day @5:30am everyday,1,claikind rise shine greet day 5 30am everyday
"@sophdea you can name our new black one, new white one, or one of the rescue ex-battery hens when they arrive. Take your pick!",1,sophdea name new black one new white one one rescue ex battery hens arrive take pick
I'm sipping the most delicious drink ever!,1,sipping delicious drink ever
@kimcoach thanks,1,kimcoach thanks
@diana_music woo for milk  have a nice day. Drop some funky beats  xxx wish I cud take you to download,1,diana music woo milk nice day drop funky beats xxx wish cud take download
"@jesse_la totally! when shes older, and hes still that age. Real cute",1,jesse la totally shes older hes still age real cute
Spilled coffee down my leg....ouch!    TaShA,1,spilled coffee leg ouch tasha
is 5 minutes from ending - what a weekend! Keep an eye out on the official website for exclusive sets and your voxpops,1,5 minutes ending weekend keep eye official website exclusive sets voxpops
@jonno. take the 3 miles in 22mins and try to beat it tomorrow,1,jonno take 3 miles 22mins try beat tomorrow
"Guyz! Follow @patriceramirez8, Please?! tnx",1,guyz follow patriceramirez8 please tnx
#mileymonday #mileymonday #mileymonday #mileymonday #mileymonday #mileymonday #mileymonday #mileymonday #mileymonday #mileymonday  retweet,1,mileymonday mileymonday mileymonday mileymonday mileymonday mileymonday mileymonday mileymonday mileymonday mileymonday retweet
Im so tired. I wanna head to the bed . So good night,1,im tired wanna head bed good night
@Eva_Abreu What is view from YOUR window?,1,eva abreu view window
hey ppl am back for sometime,1,hey ppl back sometime
back from vacay nOw it's back 2 business  GR8 Morning every1!,1,back vacay back 2 business gr8 morning every1
holiday is now booked  yayyy!!,1,holiday booked yayyy
"@___Felicity apparently lily Allen reacts massivly  just in work to six, oh the joy! You doing anything nice? So warm!",1,felicity apparently lily allen reacts massivly work six oh joy anything nice warm
for my 200th TWEET: My greatest fantasy is to be kissed in the rain on a rainy Thursday morning.,1,200th tweet greatest fantasy kissed rain rainy thursday morning
We have been delivered to the destination  What's a next station?,1,delivered destination next station
@DamienLeith hi damien just want to say love watching the video blogs cant wait 4 the album when it comes out in september,1,damienleith hi damien want say love watching video blogs cant wait 4 album comes september
YAYY!! Kelly clarkson singing on #gnw,1,yayy kelly clarkson singing gnw
@supernemo I think if I do go back it will be a waste of time aswell!! I'd rather earn money :-P,1,supernemo think go back waste time aswell would rather earn money p
here's to another wonderful month.,1,another wonderful month
does anyone wanna talk? i seriously have nothing to do &amp;  i think im gonna go crazy haha jk but i am bored. ugh gotta get ready for schol,1,anyone wanna talk seriously nothing amp think im gonna go crazy haha jk bored ugh gotta get ready schol
@angeleenekay nothing.. haha.. just wanna catch up.. i felt like missing you..,1,angeleenekay nothing haha wanna catch felt like missing
we made it almost to St.Louis we about 9 miles from it almost home it will take like 8 hours to get home to waterloo iowa,1,made almost st louis 9 miles almost home take like 8 hours get home waterloo iowa
@sjl1974 I had to google what angel delight is... and now I want to eat it too. I guess I'm a bit hungry?,1,sjl1974 google angel delight want eat guess bit hungry
Listening to Radio Nova and drinking a Tequila Sunrise,1,listening radio nova drinking tequila sunrise
Excited about guest blogging!,1,excited guest blogging
@girlygeekdom i don't worry about that...,1,girlygeekdom worry
"Hey, now that's cool. @uxbookclub has reached 1,000 followers",1,hey cool uxbookclub reached 1 000 followers
watching hannah montana with sterling knight,1,watching hannah montana sterling knight
@ladyloki You too?,1,ladyloki
@MarkClayson  that unfortunately doesn't help my cause - would prefer to back up a day!,1,markclayson unfortunately help cause would prefer back day
@nkdaydreamer that's nice good on you important thing to do,1,nkdaydreamer nice good important thing
#mileymonday #mileymonday #mileymonday #mileymonday #mileymonday #mileymonday #mileymonday #mileymonday #mileymonday #mileymonday  retwee,1,mileymonday mileymonday mileymonday mileymonday mileymonday mileymonday mileymonday mileymonday mileymonday mileymonday retwee
listening McFly One for the radio. Amazing song!,1,listening mcfly one radio amazing song
"@wheatus great stuff, I really do appreciate all the hard work you guys are putting into getting this out, can't wait",1,wheatus great stuff really appreciate hard work guys putting getting cannot wait
@dxbluey Lol! cant go any cooler than that,1,dxbluey lol cant go cooler
"@itsdarcyson lol you have a life.. a pretty good one.. i mean, i'm in it",1,itsdarcyson lol life pretty good one mean
"WOO! I hit 20,000 subscribers in my sleeping hours! Thank you!",1,woo hit 20 000 subscribers sleeping hours thank
"Ah , I'm finally having my independent streak. Im no longer waiting for my mom in the morning  lol",1,ah finally independent streak im longer waiting mom morning lol
"Finally, my BioMetricks iPhone app is approved and in the App Store  ... http://tinyurl.com/biometricks",1,finally biometricks iphone app approved app store
@progecadUK some good fixes is progeCAD 9.0.22 got some good feedback yet? Congrats on Honda BTW,1,progecaduk good fixes progecad 9 0 22 got good feedback yet congrats honda btw
@nickoj Ooooh! Would love a listen to that.,1,nickoj ooooh would love listen
@babyllou hey hows it going?,1,babyllou hey hows going
@dth Oh! Oj! Yes sir  I'll reply now!,1,dth oh oj yes sir reply
"@iusher I had a BNP MP knock on my door for votes...after the mouthful he received, I won't be seeing him again too soon.",1,iusher bnp mp knock door votes mouthful received seeing soon
I'd like to listen to the new band which is called &quot;The Baseballs&quot;. My boyfriend bought their album yesterday. Their music is awesome!,1,would like listen new band called quot baseballs quot boyfriend bought album yesterday music awesome
"hasn't done any music for days, too hot!... Loving the british weather at the moment",1,done music days hot loving british weather moment
@GLKUYKENDALL that was one of the most hilarious moments!! eminem looked really pissed. and i dont think it was scripted either,1,glkuykendall one hilarious moments eminem looked really pissed dont think scripted either
"have to say this whole following in twitter is interesting... people come and go so fast, most want to sell something...",1,say whole following twitter interesting people come go fast want sell something
I'm waiting at the VW garage for them to fix a small problem - then I'm going cruisin'!!,1,waiting vw garage fix small problem going cruisin'
"is off to scrathc some errands and appts of my list, then chaining myself to my writing desk for the rest of the week!",1,scrathc errands appts list chaining writing desk rest week
&quot;this game is easy&quot; http://bit.ly/WQO6X   - esély a royal flushre 1:649739,1,quot game easy quot
at home! got picked up early from school. exam was fine,1,home got picked early school exam fine
@playedoursong its deffinitly not hot here  in australia,1,playedoursong deffinitly hot australia
finding cooking rather therapeutic,1,finding cooking rather therapeutic
#mileymonday #mileymonday #mileymonday #mileymonday #mileymonday #mileymonday #mileymonday #mileymonday #mileymonday #mileymonday  retweet,1,mileymonday mileymonday mileymonday mileymonday mileymonday mileymonday mileymonday mileymonday mileymonday mileymonday retweet
@sarabareilles http://twitpic.com/52irk - were you one of the drunk ones?,1,sarabareilles
@sarahdrinkwater Fantastic!  Glad you liked it!,1,sarahdrinkwater fantastic glad liked
@Abbie12 good thing i didn't bother you today  did you take your enervon?,1,abbie12 good thing bother today take enervon
@BudgetsAreSexy glad you liked it there.  did you happen to Streak the Lawn??    http://tinyurl.com/mhssev,1,budgetsaresexy glad liked happen streak lawn
juss cussed out some bitch at mcdonalds for cutting us in line at the drive thru,1,juss cussed bitch mcdonalds cutting us line drive thru
"Headed home, shower and watch some tv. Listen to the mikey show at six.  Buy some monster energy drinks.",1,headed home shower watch tv listen mikey show six buy monster energy drinks
"Anyway , Peace Love &amp; Chicken Grease. Gone to Work With Bad Recepetion , so you tweeties at noon .  P.O.P NYC  &lt;3 is &lt;3",1,anyway peace love amp chicken grease gone work bad recepetion tweeties noon p p nyc lt 3 lt 3
"@Pink I love the tooheys extra dry, goes down quite well",1,pink love tooheys extra dry goes quite well
@michaelqtodd I guess you had to wash your hair,1,michaelqtodd guess wash hair
@firebirdhouse  Good Morning Kristen!,1,firebirdhouse good morning kristen
My #missingtweets are back! Thank you Twitter people!,1,missingtweets back thank twitter people
The weather needs be nicer &amp; become warmer -__- sunshine i'm missing you! come back tomorrow mmkay?,1,weather needs nicer amp become warmer sunshine missing come back tomorrow mmkay
sitting on my ass!!,1,sitting ass
@giannasmiley sure  ~ whats up!,1,giannasmiley sure ~ whats
"is back from the Sizzler   yum, yum... I'm so full now!",1,back sizzler yum yum full
"Working today, then going to Jungle Jims for supper",1,working today going jungle jims supper
"@simonpoulter at least, he already had some English lessons. Let's see if he brings Clarence",1,simonpoulter least already english lessons let us see brings clarence
@mariakitano It should happen within the next couple of days. I will be sure to post to you!,1,mariakitano happen within next couple days sure post
Too bad I'm not,1,bad
"@johncmayer - I agree! I usually bring a book, magazine or get immersed into an iPhone app  What do you do?",1,johncmayer agree usually bring book magazine get immersed iphone app
