_c0,_c1,_c2
The whole office notices when &quot;we&quot; discuss. Even in Beijing. Some things never change,1,whole office notices quot quot discuss even beijing things never change
@b0ggyb33 Good luck for image processing this afternoon,1,b0ggyb33 good luck image processing afternoon
is still on a high from the trailer,1,still high trailer
"@EmilyMarieox hahaha i really can't wait  i'll need a laugh after revision all day :/ wicked  you're gonna cry i think, it's so sad xx",1,emilymarieox hahaha really cannot wait need laugh revision day wicked gonna cry think sad xx
Have got o2 broadband. It's fab  Much better than the one I had here so will be saying goodbye to them at last,1,got o2 broadband fab much better one saying goodbye last
@whatsername2 dude it's totally pissing down over here in canning vale,1,whatsername2 dude totally pissing canning vale
get my ass out of town. ladida,1,get ass town ladida
"@the_mackem hahaha.....  looks nice outside up here, not that I'd know stuck inside!!  Time for a walk soon though....    You ok?",1,mackem hahaha looks nice outside would know stuck inside time walk soon though ok
Good morning tweeple. Hoping for a good week ahead.,1,good morning tweeple hoping good week ahead
back from exam. What a bunch of bull. Anyone up for a bbq?,1,back exam bunch bull anyone bbq
"@carlonicora ...and if that is anything to go by, then the one you have in mind should be a great lens.",1,carlonicora anything go one mind great lens
sat outside revising! Catching some rays,1,sat outside revising catching rays
Have you read the new blog at http://heartdrops.org ?,1,read new blog
"Just noticed its the first of the month, you know what that means.  what it beeee?",1,noticed first month know means beeee
Happy birthday www.lijeonline.blogspot.com (4 years).,1,happy birthday www lijeonline blogspot com 4 years
Looking forward to 'Kingdom' Sunday night ITV 9pm.,1,looking forward 'kingdom' sunday night itv 9pm
"@levi216 yeah, If I am where I am supposed to be",1,levi216 yeah supposed
@johnnysewell Thank you. I am doing a workshop at Fossil Rim Wildlife center later this year. Stay tuned...,1,johnnysewell thank workshop fossil rim wildlife center later year stay tuned
I just heard thunder. Haha I love it.,1,heard thunder haha love
I have not done any study in the past 3 days BUT my room is now clean,1,done study past 3 days room clean
"@AnthonyONeal OK, U Got It!",1,anthonyoneal ok u got
@gregnietsky so any snow yet  how r u m8,1,gregnietsky snow yet r u m8
Good morning everyone  Have a great day !!!,1,good morning everyone great day
@KyeLani perfect,1,kyelani perfect
@nagham already did. thanks,1,nagham already thanks
What a fab weekend I have had,1,fab weekend
@fionalaughton,1,fionalaughton
"@scodal Yes I did, I find it too much work, then again I'm a lazy bum",1,scodal yes find much work lazy bum
"@rambit i'm looking at linkedin everyday, don't worry! And replying sometimes too, hehe",1,rambit looking linkedin everyday worry replying sometimes hehe
no rain today,1,rain today
"@f2point4 Will keep in mind that one as well, thanks!",1,f2point4 keep mind one well thanks
shopping spree starts tomorrow!,1,shopping spree starts tomorrow
@RepubliCofFun Not this trip unfortunately! Will wave as I pass over on Wednesday night,1,republicoffun trip unfortunately wave pass wednesday night
TODAY IS GOING TO BE A GREAT DAY!!! SO EXCITED!!!,1,today going great day excited
@bellachicaboom wah bgs la hepi2..hehe,1,bellachicaboom wah bgs la hepi2 hehe
http://bit.ly/4oZWTH   then go to this one  much better,1,null
&quot;I'm question mark and I'm wondering...&quot; watching Radio Free Roscoe!,1,quot question mark wondering quot watching radio free roscoe
"Malaysia, here we come",1,malaysia come
I swear I want one of those LIFE'S GOOD braclets!!  ♥,1,swear want one life good braclets ♥
Oh and tuna salad would be great,1,oh tuna salad would great
Today is going to be a good day... actually every day is a good day... when we are fortunate enough to wake up alive.,1,today going good day actually every day good day fortunate enough wake alive
@sonnycheebah yeah. its pretty good. i really like the song. i think there opening for the Veronicas or something,1,sonnycheebah yeah pretty good really like song think opening veronicas something
@FatCoifrm21st fatcoi wake up!! Mornin,1,fatcoifrm21st fatcoi wake mornin
@LiaWhiting eu sou o mais giro ! beijo grande,1,liawhiting eu sou mais giro beijo grande
"D'Ibiza Time! Looking For Candidates To Join Me For A Summer Vacation To Europe!  St. Tropez, Monaco, Ibiza, Spain...  It'll Be Fun",1,d'ibiza time looking candidates join summer vacation europe st tropez monaco ibiza spain fun
"@sturbanclothing Happy birthday mate, hope ya get chance to cause some trouble today!",1,sturbanclothing happy birthday mate hope ya get chance cause trouble today
Got an iPhone from my dad..Thanx daddy..Love you,1,got iphone dad thanx daddy love
@Jayda_Diamonde Im going just fine thaks for asking  And how r u ?,1,jayda diamonde im going fine thaks asking r u
"@Kurty4lyf - did you lose your legal foundations exam? im confused. I found it btw, it was in my jeans pocket  im cool like that...xx",1,kurty4lyf lose legal foundations exam im confused found btw jeans pocket im cool like xx
"k home. exam went really well, probably the easiest i've had so far",1,k home exam went really well probably easiest far
@JasonBradbury love it cant wait for gadget show summer special tonite i want one of those caravan,1,jasonbradbury love cant wait gadget show summer special tonite want one caravan
@ianapplegate Glad to hear it  Although being neck-deep in that many JQuery pluins doesn't always feel that good!,1,ianapplegate glad hear although neck deep many jquery pluins always feel good
@Tarale nope - just means the insurance value will cover cost of loan -usually one of the conditions of the loan - you are covered,1,tarale nope means insurance value cover cost loan usually one conditions loan covered
@heather_cooper ouch. i don't think i was bitten once  haha. did you see the new moon trailer?,1,heather cooper ouch think bitten haha see new moon trailer
@tinchystryder makee ittt aa number onee hitt styderrr =],1,tinchystryder makee ittt aa number onee hitt styderrr
@Justheman2u yes a loooong time!,1,justheman2u yes loooong time
@cracker07 ahahah lol yeah ok people reading sarah and sarah ;) are NOT sluts ok  we just sound like sluts,1,cracker07 ahahah lol yeah ok people reading sarah sarah sluts ok sound like sluts
jus chillin at home,1,jus chillin home
@emilysanftwsom I'm pretty sure I should record it or something...  I'll watch it unless i like sleep.. Aha.,1,emilysanftwsom pretty sure record something watch unless like sleep aha
@primaveron too expensive to order online  - Heera Panna is the best . Thanks anyways,1,primaveron expensive order online heera panna best thanks anyways
Just had the coolest daydream! Who needs sleep....,1,coolest daydream needs sleep
@TheWineVault http://tinyurl.com/mtujau His range from $6 to $20+ Not a cheap author,1,thewinevault
@iota You'll have it in your head all day today.  You're welcome.,1,iota head day today welcome
#musicmonday Im on a boat - The Lonely Island Feat. T-Pain,1,musicmonday im boat lonely island feat pain
ok all necessary jobs done - time to sit and read in the sun,1,ok necessary jobs done time sit read sun
has just got out of the bath and should tidy her room. 4 months today  x,1,got bath tidy room 4 months today x
helping my cousins for an interview tmro,1,helping cousins interview tmro
@Hanescymru Truedat. I would say 'that's the price of fame' but I'd look like an arse  x,1,hanescymru truedat would say 'that price fame' would look like arse x
@johncmayer True. I learned that 10 years ago and eating alone on occasion has become completely enjoyable... ok sometimes just tolerable,1,johncmayer true learned 10 years ago eating alone occasion become completely enjoyable ok sometimes tolerable
@RNKOREA 친추할께요. 미투는 그냥 유지만 하고 있는 �?태�?요.,1,rnkorea 친추할께요 미투는 그냥 유지만 하고 있는 � 태� 요
"By the way!, Shane Dawson is Freaking Awesome!!!!!! =D  Thanks so much to My Boyfriend Chris who showed him to me!, Ha!",1,way shane dawson freaking awesome thanks much boyfriend chris showed ha
"@Wil_Anderson I'll try again! Just watching u on good news week, Excellent! u r very clever.  keep it up",1,wil anderson try watching u good news week excellent u r clever keep
"@ohflawless yaaaaaay, someone's online  so then, what d'you think of the New Moon trailer? ;D",1,ohflawless yaaaaaay someone online d'you think new moon trailer
is meeting Karla for dinner at the newly-renovated Shakey's  http://plurk.com/p/xm4rv,1,meeting karla dinner newly renovated shakey
"@tojulius Do it, and lets see how many views you can generate using your social media prowess",1,tojulius lets see many views generate using social media prowess
"Cleared sg customs, Aussie here I come!",1,cleared sg customs aussie come
School. Last monday. Very bright morning!,1,school last monday bright morning
"@nikka_d the offsprings. It's a cool song. haha. If you're mad, you can listen to it and laugh.",1,nikka offsprings cool song haha mad listen laugh
"@leahgr Monday night ABC kicks ass. Four Corners, Media Watch and Spooks",1,leahgr monday night abc kicks ass four corners media watch spooks
@vadjutka how cute,1,vadjutka cute
is loving this hot weather! chilling out doing a bit of writing and listening to great music! Great day,1,loving hot weather chilling bit writing listening great music great day
"Did the garden, free of weeds, kids having fun with magic water clown!  Weather conditions are perfect",1,garden free weeds kids fun magic water clown weather conditions perfect
i cant madam ... Its official thingi...,1,cant madam official thingi
@talkinguineapig yo txt me if u need printin &amp; i'll check email at uni. otherwise i shall c u at 4,1,talkinguineapig yo txt u need printin amp check email uni otherwise shall c u 4
Good morning tweeps,1,good morning tweeps
just got back from school,1,got back school
is going to the exhibition with the craig today,1,going exhibition craig today
@azunix thank you,1,azunix thank
@Miggy_Twitchy @SAUCEmeUP  k going to try to sleep  good luck with your whatsits and stuff!,1,miggy twitchy saucemeup k going try sleep good luck whatsits stuff
@WhippetOut Thanks for goodnight wishes. Catching up 24 hours later,1,whippetout thanks goodnight wishes catching 24 hours later
"I can have a productive day involving Monkey Island right? Also day trip with parents on Sunday hopefully, yay.",1,productive day involving monkey island right also day trip parents sunday hopefully yay
@EviLovesMcFly  Hihi. I need something to eat !! SOO hungryy ! x'DD,1,evilovesmcfly hihi need something eat soo hungryy x'dd
@TomBeasley I'm glad I'm not alone!  Let me know what you think!,1,tombeasley glad alone let know think
I have made it! Happy June 1.  Moving Day: TOMORROW!,1,made happy june 1 moving day tomorrow
@ElementsOfJazz @Lohem Happy Shavuot !!,1,elementsofjazz lohem happy shavuot
@mistressmia Luckily work from home and my gorgeous man works with me  Still adjusting to knowing what he is thinking tho...,1,mistressmia luckily work home gorgeous man works still adjusting knowing thinking tho
@maccarelle oh i didn't mean u. just in general i had no responses at all to that and a whole bunch to the avatar q  U use wp?,1,maccarelle oh mean u general responses whole bunch avatar q u use wp
"@David_Ogilvie You MUST go to Barcelona, Geneva, Zagreb, Prague, Warsaw.  Ohh the list is endless.",1,david ogilvie must go barcelona geneva zagreb prague warsaw ohh list endless
All my shots on www.cirodecaro.com ...follow me,1,shots www cirodecaro com follow
yay net! i missed you,1,yay net missed
is back ! Hello twittles!,1,back hello twittles
@Pink beer and wine...your an adopted aussie now,1,pink beer wine adopted aussie
"@bimbler yeah I am not a huge hiphop fan, but I make the occasional exception!",1,bimbler yeah huge hiphop fan make occasional exception
@lingelien don't know what you've just said but i like Ljiljana too  song 'Ashun daje mori' is my fav.,1,lingelien know said like ljiljana song 'ashun daje mori' fav
@gossip_girlxo14 steph might come  lol,1,gossip girlxo14 steph might come lol
@jakeyoh Great! performing it as part of the Arcola's Grimeborne festival-sign up to Shady news to stay in loop  http://tinyurl.com/lg24na,1,jakeyoh great performing part arcola grimeborne festival sign shady news stay loop
Got an iPhone...Thanx daddy..Love you,1,got iphone thanx daddy love
@robinoz gr8 to here from u - no technology has nothing to do with it  Am heading back 2 NZ in about 4 weeks to visit again,1,robinoz gr8 u technology nothing heading back 2 nz 4 weeks visit
"@ch_goodwin I scream, you scream, we all scream for iScream",1,ch goodwin scream scream scream iscream
Themed my summer: Upgrading my life and my lifestyle. A different Mallory will return to SF! Ready to enjoy my summer and stack paper!,1,themed summer upgrading life lifestyle different mallory return sf ready enjoy summer stack paper
@NctrnlBst Yeeeeh please do  deenablas@gmail.com,1,nctrnlbst yeeeeh please
@mikesage86 hey... when r u gona send me some of ur tunes? u promised u would..remember...,1,mikesage86 hey r u gona send ur tunes u promised u would remember
"The wolf on the New Moon trailer looks like a video game charecter, but the rest looks cool",1,wolf new moon trailer looks like video game charecter rest looks cool
@amix Congratulations to 1 year of #Plurk,1,amix congratulations 1 year plurk
Still walking on a cloud Dinner on 6/10 w/John Donahoe eBay CEO + Griff who I've had the pleasure of meeting @ eBay LIVE 2006/2007/2008,1,still walking cloud dinner 6 10 w john donahoe ebay ceo griff pleasure meeting ebay live 2006 2007 2008
@CHRISDJMOYLES go chill with a beer in the garden! and have one for me too,1,chrisdjmoyles go chill beer garden one
oh my god.... I'm sure I'll lose myself here,1,oh god sure lose
@dgabby16 aboutt what missy?  aha.,1,dgabby16 aboutt missy aha
@creattica Indeed. It depends on how one codes for the post title  speaking of which... oncontextmenu=&quot;return false;&quot; is a total nightmare,1,creattica indeed depends one codes post title speaking oncontextmenu quot return false quot total nightmare
BUT two weeks till @jonasbrothers and @ddlovato  excited,1,two weeks till jonasbrothers ddlovato excited
I just saw the trailer for new moon and my inner fangirlness is screaming for taylor lautner,1,saw trailer new moon inner fangirlness screaming taylor lautner
@CheesyLouisey yehh &quot;/ they should've cut it off halfway through his change or something,1,cheesylouisey yehh quot cut halfway change something
@nicolaymusic you're welcome,1,nicolaymusic welcome
@Dr_DinaSadik surething,1,dr dinasadik surething
"@JodiCleghorn I was thinking of you last week, there is a &quot;Gleghorn road&quot; in Kallista",1,jodicleghorn thinking last week quot gleghorn road quot kallista
"I am watching #FrenchOpen. Svetlana Kuznetsova has just won! Woo-hoo! Russia, go ahead!",1,watching frenchopen svetlana kuznetsova woo hoo russia go ahead
"@ashleigh92 you can still have a good lunch without eatin like a piggy :') haha, thank you baby  i love you xxx",1,ashleigh92 still good lunch without eatin like piggy ' haha thank baby love xxx
"I'm all packed up and headed out East--next stop, Russia!",1,packed headed east next stop russia
@ejcanita Evening basketball practice on a Saturday?! Weeeeeh.,1,ejcanita evening basketball practice saturday weeeeeh
Nightmare last night :/ I've been sleeping on and off since 2. IT'S THUNDERSTORMING AND I'M HAPPY!,1,nightmare last night sleeping since 2 thunderstorming happy
haven't tweeted in a while.... feel so accomplished with the curry dinner which the boys are SO-oooo fond of... encore already!,1,tweeted feel accomplished curry dinner boys oooo fond encore already
@SandiMon some friends and I do something similar called a circle Journal,1,sandimon friends something similar called circle journal
"@ThePhenomena  Oh it's hard to wait for feedback, isn't it?",1,thephenomena oh hard wait feedback
"@snedwan Lucky tw*t.....  oops, did I say that out loud!!  Sorry........",1,snedwan lucky tw oops say loud sorry
hopes Silah has a good flight.,1,hopes silah good flight
my hair is blonder,1,hair blonder
congrats Zac   maybe next year Vanessa (yn),1,congrats zac maybe next year vanessa yn
"That was fun tbh, laura is so nice &amp;we had good chat",1,fun tbh laura nice amp good chat
@janerawson and by 'never again not know when shit happens in the world' I mean 'I will know when my fav webcomics have an update',1,janerawson 'never know shit happens world' mean 'i know fav webcomics update'
"finally, love cleaning my room!!   LOL!! --_--",1,finally love cleaning room lol
"@Maialan E3afeech , 6aaaaaafech 7adaa 6afech",1,maialan e3afeech 6aaaaaafech 7adaa 6afech
"Swimming today, then BBQ    still slightly worried a creepy old lady will come up to me and curse me... eep :S",1,swimming today bbq still slightly worried creepy old lady come curse eep
Getting ready for work,1,getting ready work
"@helen_lo should you ever want one, am happy to help u create it",1,helen lo ever want one happy help u create
"@TheMrKrabs i worked today, that means money",1,themrkrabs worked today means money
"@TomFelton hey tom, i want see you, like malfoy, wanting kill dumbledore *-* u are so hoot like malfoy. i love your white hair.",1,tomfelton hey tom want see like malfoy wanting kill dumbledore u hoot like malfoy love white hair
omg.. my shower was too refreshing i think..,1,omg shower refreshing think
New Moooooooon!!!! I can't wait for movie!!!,1,new moooooooon cannot wait movie
"watching David Archuleta cooking on youtube,so cutee",1,watching david archuleta cooking youtube cutee
"Sunshine, cider and ice cream with Lisa, who needs the O.C?  x",1,sunshine cider ice cream lisa needs c x
Has just watched the New Moon Preview..........OMG I want 20.11.09 to hurry up  Twilight Twilght Twilight,1,watched new moon preview omg want 20 11 09 hurry twilight twilght twilight
"@egaurdo26 Oh you better see to it that it is done this weekend! Oh, I am not? I shall do it now",1,egaurdo26 oh better see done weekend oh shall
"Alrite. My Kolkota trip is confirmed. Will be there on Wednesday. It is one city i wanted to go for a long time, not only for Dada",1,alrite kolkota trip confirmed wednesday one city wanted go long time dada
@Iren19 ... because I'm gonna live with my dad and his gf...,1,iren19 gonna live dad gf
so excited so so excited,1,excited excited
"hello monday, 7 more days",1,hello monday 7 days
Looking forward to a lunchtime run ... sort of ... after a week off it's probably going to hurt!,1,looking forward lunchtime run sort week probably going hurt
LOL. Epic win. Administrators just watched me twat from my iTouch ad didn't give a fuck,1,lol epic win administrators watched twat itouch ad give fuck
@bradhassett Welcome to London! Enjoy the weather while it lasts.,1,bradhassett welcome london enjoy weather lasts
'Aving a lunchtime laugh with L Vaughn Spencer,1,'aving lunchtime laugh l vaughn spencer
HEY MONDAY ON FUSE. Made my fucking morning. GOOD MORNING WORLD.,1,hey monday fuse made fucking morning good morning world
People seem to really like the Ripit ad on http://smokingapples.com,1,people seem really like ripit ad
"@mariakitano You are very welcome Maria! Your love for making art clearly shows up in your work. Of course, people appreciate seeing that",1,mariakitano welcome maria love making art clearly shows work course people appreciate seeing
@DeAndreWay I like that background better for that purpose.  The other pic is good but the txt covers your face.  Pointless.,1,deandreway like background better purpose pic good txt covers face pointless
@adalinelau We have 29.1 days more to wrap up the first half of the year.  Let's make the most out of it.,1,adalinelau 29 1 days wrap first half year let us make
http://twitpic.com/6e90f - Mondays Menu at the Brunchbox  See you there !,1,null
"@nwjerseyliz Good morning, Liz",1,nwjerseyliz good morning liz
ahh feeling much betterrr  made up with rudi (L),1,ahh feeling much betterrr made rudi l
"george sampson+ the mcfly boysssssss, i love you guyssss  xxx",1,george sampson mcfly boysssssss love guyssss xxx
I used to be nenasymone   I changed it to make for easier introductions lol...,1,used nenasymone changed make easier introductions lol
@brianna_xo so jealous of you. When you've got time can you send me there songs please,1,brianna xo jealous got time send songs please
@stratosphear true but Mulcair as the 1 MP for NDP in QC had a 2 years of free coverage on tv  and he knows how to reach Anglo and French,1,stratosphear true mulcair 1 mp ndp qc 2 years free coverage tv knows reach anglo french
tired and hungry... mimi is coming...,1,tired hungry mimi coming
I'm listening to Bullet For My Valentine's albums &amp; can't wait for the new album! Good luck guys  Make us something AWESOME !!! &lt;3,1,listening bullet valentine albums amp cannot wait new album good luck guys make us something awesome lt 3
Good morning you lovely people,1,good morning lovely people
"off to the fh we have a graveside, dressing &amp; casketing, and lots of paperwork",1,fh graveside dressing amp casketing lots paperwork
in ohio. heading back to rochester in a few hours. not missing the students,1,ohio heading back rochester hours missing students
@DogBountyHunter Thanks for the follow! Have a good day,1,dogbountyhunter thanks follow good day
Ugh i really dont wanna go to school =/ but i get to see Cody afterward,1,ugh really dont wanna go school get see cody afterward
"Ladies and Gentlemen, www.bing.com is live.   (rollouts will continue however to partners and other mkts, more to come) ^betsy (via @bing)",1,ladies gentlemen www bing com live rollouts continue however partners mkts come ^betsy via bing
Beautiful sunny day. Low humidity. Beginning of summer in MD....NICE!!!,1,beautiful sunny day low humidity beginning summer md nice
@nicosiaoceania 'kay.. thanks! imma check it out now..  er... thanks for the advice! I'll have to remember that..,1,nicosiaoceania 'kay thanks imma check er thanks advice remember
@Mariiesen html on blogger. It was all caps font but I managed to find the 'tex-transform' and delete it.,1,mariiesen html blogger caps font managed find 'tex transform' delete
@GeorgeJonesJr go get an adapther at the corner store. only 5bux... pounds. i love u,1,georgejonesjr go get adapther corner store 5bux pounds love u
"@ultimadj Madei tall the way, luckily",1,ultimadj madei tall way luckily
had a nice coffee break and chat with @alexcg! Thanks... Let's keep in touch,1,nice coffee break chat alexcg thanks let us keep touch
andy samburg got the sickest intro for mtv  http://bit.ly/193Vel  even tho mtv is purely bs,1,andy samburg got sickest intro mtv
@smileyeily it's bank holiday here! Woot  I presume that's why @sineadcochrane isn't on! Picnic yay ;),1,smileyeily bank holiday woot presume sineadcochrane picnic yay
Lunchtime!  Going to sit out in my garden and read,1,lunchtime going sit garden read
@laurenmichaels have a great day!  hope your head isnt throbbing anymore..,1,laurenmichaels great day hope head isnt throbbing anymore
Just woke my best frann in the nick of time,1,woke best frann nick time
BBL ppl ~ have to go to school~,1,bbl ppl ~ go school~
Just got home,1,got home
Coffee in hand Today 2 pair of custom denim jeans. Can we say tiny in the waist  (via @Clothesmaker) [ u betts behave],1,coffee hand today 2 pair custom denim jeans say tiny waist via clothesmaker u betts behave
What special software does HarryPotter have on his computer?...A Spell Checker! Thank You Wotsits,1,special software harrypotter computer spell checker thank wotsits
@khali_blache Drinking and about to play Five Hundred,1,khali blache drinking play five hundred
Will be away for a few minutes now. LUNCH!  hehe x,1,away minutes lunch hehe x
@Saxha do you have the link to the trailer?,1,saxha link trailer
Oh shit!! just going up the stairs to catch my train and this woman was running in front of me with one very short skirt! I see booty,1,oh shit going stairs catch train woman running front one short skirt see booty
@SiriusCorp Still waiting for some open source companies to reply to my sending them the checklist .... There will be a sequel.,1,siriuscorp still waiting open source companies reply sending checklist sequel
@MysweetMelody Nice tie! I love the green.,1,mysweetmelody nice tie love green
I'm buying the cool Pisay shirt tomorrow!!  Kayo rin! Hahaha ),1,buying cool pisay shirt tomorrow kayo rin hahaha
@1WineDude That's a really cool giveaway!,1,1winedude really cool giveaway
"It's so waaaaaarm, la la la.  AND just got a better grade than expected on that impossible shakespeare essay",1,waaaaaarm la la la got better grade expected impossible shakespeare essay
done eating - i don't know what I ate. but the dessert was yummy. Royce'.  hehehe.,1,done eating know ate dessert yummy royce' hehehe
@OhSweetNibblets SANA!  it's been awhile! how were your other exams?,1,ohsweetnibblets sana awhile exams
leaving in 10  gonna pick my cake. woo,1,leaving 10 gonna pick cake woo
@emmagemtweets there are simply waaaay too many unloved animals out there... we just try to do what little we can,1,emmagemtweets simply waaaay many unloved animals try little
@heycassadee i can't wait for it either! ): rob pattinson's sooooo hot. and gosh vampires!,1,heycassadee cannot wait either rob pattinson sooooo hot gosh vampires
Just watched Monsters Vs Aliens with C60! Gonna eat dinner together now  - http://tweet.sg,1,watched monsters vs aliens c60 gonna eat dinner together
